id,title,description,datePosted,skills,categories,employmentTypes,locationTypes,countries,companyName,companyType,Industry
170871505,Senior Director of Technical Program Management - Remote,"At PayNearMe, we’re on a mission to make paying and getting paid as simple as possible. We build innovative technology that transforms the way businesses and their customers experience payments. Our industry-leading platform, PayXM™, is the first of its kind—designed to manage the entire payment experience from start to finish. Every click, swipe or tap is seamless, fast and secure, helping non-commerce businesses boost customer satisfaction, accelerate payments, and reduce costs.Our single platform handles it all: cards, ACH, digital wallets such as PayPal, Venmo, Cash App Pay, Apple Pay and Google Pay, and even cash at more than 62,000 retail locations nationwide. Today, thousands of businesses across consumer lending, iGaming and online sports betting, property management, and tolling trust PayNearMe to deliver a payment experience that drives real results.In September 2025, we raised a $50 million Series E funding round to accelerate our growth. We’re a team of 200+ employees across 41 states, headquartered in Silicon Valley with satellite offices in Dallas, TX and Holmdel, NJ.Join us and be part of a team that’s shaping the future of payments—one experience at a time.As the Senior Director of Technical Program Management, you will be a key driver of efficiency, growth, and scalability at PayNearMe. This role focuses on  maturing and scaling strategic technical program management practices to align operational processes with long-term business objectives. Reporting to the VP of Business Operations and partnering closely with our Product and Engineering leadership, you will oversee and ensure the delivery of our most critical cross-functional programs, with visibility into the full technical portfolio. You will evaluate, implement, and enhance project management best practices to strengthen program teams, tools, and communication channels. This role will also be accountable for driving reliability and quality programs that strengthen production readiness, incident response, and systemic risk management. Balance leading key programs directly while also coaching and developing the TPM team, focusing on building, developing, and mentoring a high-performing TPM team, fostering a culture of continuous improvement. Your technical depth and strategic leadership will be crucial in ensuring delivery predictability, aligning processes with business goals, promoting team growth, and maintaining high standards of delivery excellence to achieve our company’s objectives.Key Responsibilities:Portfolio Leadership: Provide strategic direction across PayNearme’s technical program portfolio, ensuring alignment with company goals and clear visibility for leadership.Reliability & QualityLead cross-functional programs that strengthen system reliability, scalability, and production readiness. Governance: Provide oversight and program leadership across PayNearMe’s technical project and program portfolio to drive successful execution. Operational Excellence: Determine and implement technical project management best practices to ensure efficient and effective delivery.Lead the organization to streamline processes, simplify and accelerate execution, manage objectives and key results, release on time, and bring tooling efficiencies.Own and continuously improve the efficiency and consistency of technical delivery.Collaborate to identify systemic inefficiencies and implement data-driven solutions to address them.Drive company-wide planning, cross team alignment, and delivery health reporting across teams. Program and Project Management:Partner with Product, Engineering, and business leadership to define and deliver strategic  technical programs with company goals.Ensure visibility and accountability by communication goals, milestones, timelines, and metrics to executives and stakeholders.Lead all aspects of program execution, including prioritization, mobilizing cross-functional teams, tracking progress, resource planning, and risk remediation to deliver business and customer outcomes. Scale process and tools to support larger teams and increasing complexity. Apply technical fluency to inform decisions, anticipate risks, and act as a trusted thought partner to Product and Engineering leads.Team Leadership and GrowthLead efforts to scale and standardize the TPM function across the organization, creating frameworks and fostering innovation.Balance leading high-priority programs with hiring, mentoring, and developing a TPM team that builds trusted partnerships and domain expertise. Develop talent within the team by establishing mentorship programs, professional development opportunities, and cross-training initiatives.Be a culture carrier, connecting the organization to the company’s core values, building trusted relationships across functions and fostering a culture of accountability and continuous improvementB.S. in Computer Science or a related technical discipline, or equivalent experience.10+ years of technical program management experience, leading complex technology projects and programs.5+ years of people management experience leading teams to deliver technical programs or products from inception to delivery.Proven experience identifying and addressing systemic inefficiencies and scaling technical programs.Experience building, growing, and leading a technical program management organization.Expertise with Agile and Scrum frameworks and the application in product development and delivery.Fluency with the Atlassian ecosystem; Jira, Jira Product Discovery, Advanced roadmaps, and Atlas.  Strong communication and executive presence; able to influence across all levels. Proven interpersonal skills, including relationship building and collaboration within a cross-functional team.Ability to influence across virtual teams and disparate stakeholder groups.Strategic, organizational thinker with a track record of strengthening program governance and controls within an organization.BenefitsBase salary per year (paid semi-monthly)Fast- paced and professional work cultureStock options with standard startup vesting - 1 year cliff; 4 years total$50 monthly communication expense stipend to go towards your phone/internet bill$250 stipend to enhance your WFH setupReimbursement for peripheral equipment: monitor (up to $400), keyboard and mouse (up to $200)Premium medical benefits including vision and dental (100% coverage for employees)Company-sponsored life and disability insurancePaid parental bonding leavePaid sick leave, jury duty, bereavement401k planFlexible Time Off (our team members typically take off ~3-4 weeks per year)Volunteer Time Off13 scheduled holidays4-6x / year in-person team meet-ups Location: Flexible/Remote (within the US)Salary Range: $200,000 - 250,000PayNearMe strives to create a workplace where all employees thrive. Our core values represent who we are today and we take pride in the way we work with each other as well as with our stakeholders.We’re in this together to do the right thing. We deliver real results we are proud of while remaining respectful, transparent, and flexible.PayNearMe is an equal opportunity employer. We are diligently and thoughtfully working towards cultivating a diverse workforce which in turn, enhances our products and services for the communities we serve. Applicants who represent all backgrounds are strongly encouraged to apply.—CALIFORNIA CONSUMER PRIVACY ACT: APPLICANT NOTICECandidate information will be treated in accordance with our job applicant privacy notice found at: https://home.paynearme.com/ccpa-privacy-notice-jobs-employees/Assistance for Disabled ApplicantsAlternative formats of this Notice are available to individuals with a disability. Please let us know if you need assistance.All your information will be kept confidential according to EEO guidelines.",2025-10-06 05:19:02+00:00,jira,management,fulltime,remote,us,PayNearMe,Privately Held,Financial Services
170871504,Staff Technical Program Manager (Reliability and Quality) - Remote,"At PayNearMe, we’re on a mission to make paying and getting paid as simple as possible. We build innovative technology that transforms the way businesses and their customers experience payments. Our industry-leading platform, PayXM™, is the first of its kind—designed to manage the entire payment experience from start to finish. Every click, swipe or tap is seamless, fast and secure, helping non-commerce businesses boost customer satisfaction, accelerate payments, and reduce costs.Our single platform handles it all: cards, ACH, digital wallets such as PayPal, Venmo, Cash App Pay, Apple Pay and Google Pay, and even cash at more than 62,000 retail locations nationwide. Today, thousands of businesses across consumer lending, iGaming and online sports betting, property management, and tolling trust PayNearMe to deliver a payment experience that drives real results.In September 2025, we raised a $50 million Series E funding round to accelerate our growth. We’re a team of 200+ employees across 41 states, headquartered in Silicon Valley with satellite offices in Dallas, TX and Holmdel, NJ.Join us and be part of a team that’s shaping the future of payments—one experience at a time.We're looking for an experienced, technical Staff-level Technical Program Manager (TPM) to lead our Quality and Reliability efforts across critical systems and services. This is a high-impact, individual contributor role for someone who has done this before, who can build structure where needed, navigate ambiguity, and drive outcomes across multiple teams and domains.You’ll be responsible for leading cross-functional programs to improve system reliability, scalability, and operational quality, from improving incident response and production readiness to redefining the ways we test and deploy software. This is not a generalist role: we’re looking for a TPM with deep technical fluency and a track record of shaping system-level quality and delivery culture at scale.What You’ll DoOwn the Quality & Reliability Program: Define and drive the vision for quality—across proactive practices (testing, deployment, observability), reactive processes (incident response, external communications), and cultural expectations (quality ownership, readiness).Lead Cross-Functional Programs: Drive reliability and quality initiatives across Engineering, Product, Operations, and Customer Success.Production Readiness: Own the Production Readiness Review (PRR) process; ensure all releases meet reliability standards before they go live.Define and Drive SLOs: Establish and track Service Level Objectives (SLOs). Build visibility into reliability metrics and lead efforts to meet or exceed targets.Improve Incident Management: Streamline incident response and postmortems. Drive structural improvements in tooling, communication, and ownership.Scale Tooling & Automation: Collaborate across teams to enhance observability, alerting, testing automation, and response tooling.Mitigate System Risk: Identify risk vectors early, build mitigation plans, and drive resolution with urgency.Drive Alignment: Influence across Eng, Product, Ops, and GTM teams to prioritize reliability and integrate quality into every initiative.Track Progress: Use tools like Atlas, Jira, and internal dashboards to maintain clarity on goals, risks, and outcomes.Embed Continuous Learning: Build programs that ensure we learn from every incident, test edge cases, and continuously harden our systems.8+ years of program management experience, with at least 3 years in technical, reliability, or quality-focused domains.Strong understanding of system architecture, distributed systems, and reliability engineering principles.Familiarity with SDLC models, CI/CD pipelines, deployment automation, observability, and incident management tooling.Demonstrated success defining and improving SLOs, SLIs, and production readiness processes.Proven ability to lead large-scale, cross-functional programs across Engineering, Product, Operations, and Customer Success.Skilled at translating complex technical goals into clear, actionable, and measurable outcomes.Experienced in using Atlassian tools (e.g., Jira, Atlas) for program tracking, reporting, and executive communication.Adept at navigating ambiguity, building alignment, and driving decision-making without formal authority.Comfortable balancing technical depth with business priorities to influence outcomes.Bachelor’s degree in Computer Science, Engineering, or related technical field, or equivalent practical experience.Bonus: Experience in regulated or high-availability industries such as fintech, healthcare, or infrastructure.BenefitsBase salary per year (paid semi-monthly)Fast- paced and professional work cultureStock options with standard startup vesting - 1 year cliff; 4 years total$50 monthly communication expense stipend to go towards your phone/internet bill$250 stipend to enhance your WFH setupReimbursement for peripheral equipment: monitor (up to $400), keyboard and mouse (up to $200)Premium medical benefits including vision and dental (100% coverage for employees)Company-sponsored life and disability insurancePaid parental bonding leavePaid sick leave, jury duty, bereavement401k planFlexible Time Off (our team members typically take off ~3-4 weeks per year)Volunteer Time Off13 scheduled holidays2x / year in-person team meet-ups Salary Range: $190,000 - 220,000 PayNearMe strives to create a workplace where all employees thrive. Our core values represent who we are today and we take pride in the way we work with each other as well as with our stakeholders.We’re in this together to do the right thing. We deliver real results we are proud of while remaining respectful, transparent, and flexible.PayNearMe is an equal opportunity employer. We are diligently and thoughtfully working towards cultivating a diverse workforce which in turn, enhances our products and services for the communities we serve. Applicants who represent all backgrounds are strongly encouraged to apply.—Candidate information will be treated in accordance with our job applicant privacy notice found at: https://home.paynearme.com/ccpa-privacy-notice-jobs-employees/Assistance for Disabled ApplicantsAlternative formats of this Notice are available to individuals with a disability. Please let us know if you need assistance.All your information will be kept confidential according to EEO guidelines.",2025-10-06 05:19:45+00:00,"cicd, jira",Unknown,fulltime,remote,us,PayNearMe,Privately Held,Financial Services
170871503,Account Executive (Mid-Market Sales) - Remote,"At PayNearMe, we’re on a mission to make paying and getting paid as simple as possible. We build innovative technology that transforms the way businesses and their customers experience payments. Our industry-leading platform, PayXM™, is the first of its kind—designed to manage the entire payment experience from start to finish. Every click, swipe or tap is seamless, fast and secure, helping non-commerce businesses boost customer satisfaction, accelerate payments, and reduce costs.Our single platform handles it all: cards, ACH, digital wallets such as PayPal, Venmo, Cash App Pay, Apple Pay and Google Pay, and even cash at more than 62,000 retail locations nationwide. Today, thousands of businesses across consumer lending, iGaming and online sports betting, property management, and tolling trust PayNearMe to deliver a payment experience that drives real results.In September 2025, we raised a $50 million Series E funding round to accelerate our growth. We’re a team of 200+ employees across 41 states, headquartered in Silicon Valley with satellite offices in Dallas, TX and Holmdel, NJ.Join us and be part of a team that’s shaping the future of payments—one experience at a time.As an Account Executive focused on Mid Market Sales, you will play a crucial role in fueling PayNearMe’s growth by securing new business specializing in the auto and personal lending verticals. You'll be responsible for the full sales cycle, from prospecting to closing, leveraging your knowledge of payment solutions to meet and exceed sales targets.Responsibilities:Develop and execute targeted sales strategies to engage prospects within the auto and personal lending industry, showcasing the value of PayNearMe's payment solutions.Build and nurture strong relationships with key decision-makers and stakeholders at lending institutions, understanding their unique needs and providing tailored payment solutions.Work in a highly transactional sales team conducting weekly discovery calls with prospects and signing 3 to 4 agreements per quarterLead the end-to-end sales process, including prospecting, needs analysis, solution presentation, negotiation, and contract closure, while collaborating with internal teams for seamless implementation.Stay abreast of industry trends, regulations, and competitor activities within auto and personal lending, providing insights to inform product development and strategic positioning.Challenge prospects existing business processes and educate on new technologies to address legacy business painsProvide regular sales forecasts, reports, and updates utilizing CRM & Sales tools to track and manage sales activities.3+ years of relevant experience in Enterprise/ Mid Market sales, specifically focused on payments, with a preference for those with experience in the lending sector.In-depth understanding of lending processes, payments, and regulatory landscape within the auto and personal lending sector.Experience with Challenger Sales Methodology, a plus.Strong analytical and strategic thinking, using data-driven insights to shape sales strategies and drive revenue growth.Self-motivated and results-oriented, with the ability to excel in a fast-paced and evolving environment.Proficiency in CRM tools and sales software to manage pipeline, forecasting, and reporting.Ability to travel as needed to engage with clients and attend industry events.Base salary per year (paid semi-monthly)Fast- paced and professional work cultureStock options with standard startup vesting - 1 year cliff; 4 years total$50 monthly communication expense stipend to go towards your phone/internet bill$250 stipend to enhance your WFH setupReimbursement for peripheral equipment: monitor (up to $400), keyboard and mouse (up to $200)Premium medical benefits including vision and dental (100% coverage for employees)Company-sponsored life and disability insurancePaid parental bonding leavePaid sick leave, jury duty, bereavement401k planFlexible Time Off (our team members typically take off ~3-4 weeks per year)Volunteer Time Off13 scheduled holidays2x / year in-person team meet-ups (2-3 days, company paid)Salary Range: $120,000 - $140,000
Variable: $100,000
PayNearMe strives to create a workplace where all employees thrive. Our core values represent who we are today and we take pride in the way we work with each other as well as with our stakeholders.We’re in this together to do the right thing. We deliver real results we are proud of while remaining respectful, transparent, and flexible.PayNearMe is an equal opportunity employer. We are diligently and thoughtfully working towards cultivating a diverse workforce which in turn, enhances our products and services for the communities we serve. Applicants who represent all backgrounds are strongly encouraged to apply.—CALIFORNIA CONSUMER PRIVACY ACT: APPLICANT NOTICEEffective Date: January 1, 2020Last Reviewed on: December 23, 2019PayNearMe, Inc. (the “Company”) is providing you with this Notice (“Notice”) to inform you about:the categories of Personal Information that the Company collects and maintains about applicants; andthe purposes for which the Company uses that Personal Information.For purposes of this Notice, “Personal Information” means information that identifies, relates to, describes, is capable of being associated with, or could reasonably be linked, directly or indirectly with, a natural person that the Company may collect in connection with screening applicants for job openings at the Company.Identifiers and Professional or Employment-Related Information. The Company collects identifiers and professional or employment-related information, which may include some or all the following: real name, nickname or alias, postal address, telephone number, e-mail address, membership in professional organizations, professional certifications, language skills, and current and past employment history. The Company collects this Personal Information to evaluate previous job performance and consider applicants for positions, to develop a talent pool and plan for succession, to conduct applicant surveys, to maintain an internal applicant directory and for purposes of identification, to promote the Company as a place to work, and for workforce reporting and data analytics/trend analysis.Personal Information Categories from Cal. Civ. Code § 1798.80(e). The Company may collect categories of Personal Information listed in Cal. Civ. Code §1798.80(e), other than those already listed above, (a) to the extent necessary to comply with the Company’s legal obligations, such as to accommodate disabilities; (b) to conduct a direct threat analysis in accordance with the Americans with Disabilities Act and state law; (c) for occupational health and safety compliance and record-keeping; and (d) to respond to an applicant’s medical emergency.Characteristics of Protected Classifications Under California or Federal Law. The Company may collect information about race, age, national origin, disability, sex, and veteran status as necessary to comply with legal obligations, including the reporting requirements of the federal Equal Employment Opportunity Act, the federal Office of Contracting Compliance Programs (applicable to government contractors), and California’s Fair Employment and Housing Act. The Company collects this Personal Information for purposes including: to comply with Federal and California law related to accommodation. The Company also collects this category of Personal Information on a purely voluntary basis, except where required by law, and uses the information only in compliance with applicable laws and regulations.Education Information. The Company collects education information such as resumes and graduation records. The Company collects this Personal Information to determine suitability for roles, to determine eligibility for training courses, and to assist with professional licensing.Profile Data. The Company may collect profile data, including the following: psychological assessments, behavior analyses, or other profiling of its applicants. The Company collects this Personal Information to determine aptitude for certain positions and job assignments as well.Background Screening Information. In the event that an applicant is given a formal job offer, the Company collects background screening information prior to hiring, including results of the following types of background screening: criminal history; sex offender registration; motor vehicle records; credit history; employment history; drug testing; and educational history. The Company collects this Personal Information to screen for risks to the Company and its clients, and continued suitability for their jobs and to evaluate applicants for promotions.Assistance for Disabled ApplicantsAlternative formats of this Notice are available to individuals with a disability. Please let us know if you need assistance.All your information will be kept confidential according to EEO guidelines.",2025-10-06 05:21:25+00:00,Unknown,sales,fulltime,remote,us,PayNearMe,Privately Held,Financial Services
